{
  "$schema": "http://json-schema.org/draft-07/schema#",
  "$id": "workflow-production-source-v1.schema.json",
  "title": "Workflow production source universe (v1)",
  "description": "Shape written by scripts/resolveProductionSourceUniverse.mjs to workflow-production-source-baseline-v1.json (regenerable, evidence-backed) and workflow-production-source-live-v1.json (regenerated every run), and by scripts/generatePregateProductionSourceBaseline.mjs to workflow-production-source-pregate-v1.json (immutable; adds pregateGitRef/pregateGitSha). Enforced by hand-rolled structural checks in those scripts rather than a JSON-Schema validator library, since this project has no ajv dependency; keep the two in sync by hand.",
  "type": "object",
  "required": [
    "schemaVersion",
    "generatedBy",
    "packageName",
    "packageVersion",
    "fileCount",
    "files",
    "shippedAssets"
  ],
  "properties": {
    "schemaVersion": { "const": 1 },
    "generatedBy": { "type": "string" },
    "description": { "type": "string" },
    "packageName": { "type": "string" },
    "packageVersion": { "type": "string" },
    "declaredMain": { "type": "string" },
    "entrypoint": { "type": "string", "const": "src/extension.ts" },
    "outfile": { "type": "string" },
    "bundlerName": { "type": "string", "const": "esbuild" },
    "bundlerVersion": { "type": "string" },
    "typescriptVersion": { "type": "string" },
    "buildOptionsDigestSha256": { "type": "string", "pattern": "^[0-9a-f]{64}$" },
    "lockfileSha256": { "type": ["string", "null"], "pattern": "^[0-9a-f]{64}$" },
    "pregateGitRef": { "type": "string", "description": "Pre-gate snapshot only: the ref passed to generatePregateProductionSourceBaseline.mjs." },
    "pregateGitSha": { "type": "string", "pattern": "^[0-9a-f]{40}$", "description": "Pre-gate snapshot only: the resolved full commit SHA the snapshot was frozen at." },
    "fileCount": { "type": "integer", "minimum": 0 },
    "files": {
      "type": "array",
      "description": "Bundled TS/JS production sources reachable from src/extension.ts via the shared esbuild.config.js options.",
      "items": {
        "type": "object",
        "required": ["path", "sha256"],
        "properties": {
          "path": {
            "type": "string",
            "description": "Repo-relative, POSIX-separated path. Never src/test/**, *.test.*, *.spec.*, test-stubs/**, or test-fixtures/**, except the single documented exception for package.json (read at runtime for version metadata)."
          },
          "sha256": { "type": "string", "pattern": "^[0-9a-f]{64}$" }
        },
        "additionalProperties": false
      }
    },
    "shippedAssets": {
      "type": "array",
      "description": "Non-bundled shipped files classified by scripts/lib/productionSourceScan.mjs: package.json contribution/icon-referenced images, and resources/prompts/*.md runtime-resource copies read via vscode.workspace.fs at runtime.",
      "items": {
        "type": "object",
        "required": ["path", "sha256", "category"],
        "properties": {
          "path": { "type": "string", "description": "Repo-relative, POSIX-separated path." },
          "sha256": { "type": "string", "pattern": "^[0-9a-f]{64}$" },
          "category": {
            "type": "string",
            "enum": ["contributionAsset", "runtimeResourceCopy", "readmeReferencedAsset", "vectorSourceCompanion"]
          }
        },
        "additionalProperties": false
      }
    }
  },
  "additionalProperties": false
}
