{
  "schemaVersion": 1,
  "generatedBy": "scripts/resolveProductionSourceUniverse.mjs",
  "description": "Production source universe as of the current working tree, resolved from the exact bundler options that produce dist/extension.js (esbuild.config.js) plus the contribution-asset and runtime-resource-copy rules in scripts/lib/productionSourceScan.mjs. Regenerated every run; diffed against the immutable pre-gate snapshot (workflow-production-source-pregate-v1.json), not authoritative on its own.",
  "packageName": "vs-code-ai-helper",
  "packageVersion": "0.68.1",
  "declaredMain": "./dist/extension.js",
  "entrypoint": "src/extension.ts",
  "outfile": "dist/extension.js",
  "bundlerName": "esbuild",
  "bundlerVersion": "0.19.12",
  "typescriptVersion": "5.9.3",
  "buildOptionsDigestSha256": "59b9af38338f674e6503e84e1945f3c7b2e65f3aab5e1acec211ca45a20c3d07",
  "lockfileSha256": "8df5712b6f8e20446c74bb0ebf444ca707fb666b5a35214b92ad7d155c4b28f6",
  "fileCount": 139,
  "files": [
    {
      "path": "src/actions/actionConversationOrchestratorV1.ts",
      "sha256": "474a681182f9535920c29abc1556dc91e3c404b91ba7cb5d3fea0756f986ff90"
    },
    {
      "path": "src/actions/productionTaskActionRuntimeV1.ts",
      "sha256": "318380a7e826e13fb05744aa030e25b4f77633630cabcb771983a8b878d2965a"
    },
    {
      "path": "src/actions/rows/applyReviewRowV1.ts",
      "sha256": "42773aa8531568322d25d390a86f9847becca3bb74546fcf6a58f6bb61d2b52f"
    },
    {
      "path": "src/actions/rows/chatSendRowV1.ts",
      "sha256": "3ccc3dabaf89e6e24dbfa2bfdd19edac39524773e2ea6eaf91f904aef7d79b60"
    },
    {
      "path": "src/actions/rows/commitPushMetadataRowV1.ts",
      "sha256": "f6a75d17af1cfdeab29de7f7480be868108fc6f181b8bed85654098782a5f166"
    },
    {
      "path": "src/actions/rows/draftRowV1.ts",
      "sha256": "8e8b67a3bec2b67964e30e5db773e1bc3ce93345758994d4b940c57392e06a37"
    },
    {
      "path": "src/actions/rows/generateImplementationRowV1.ts",
      "sha256": "d7de62f797c5374f5065bb12de207dbf5b855cef7899e03e05827fe48032ef68"
    },
    {
      "path": "src/actions/rows/generatePlanRowV1.ts",
      "sha256": "8c98661dcfc5ce894d34a1e780ed13468f725de4855658ee1eeed6eaa8755a4b"
    },
    {
      "path": "src/actions/rows/reviewRowV1.ts",
      "sha256": "fdd868ae6dd74ab40152d745c5a627fd7d16f3fdd1a4a3edaa2372aa9297f9ec"
    },
    {
      "path": "src/actions/taskActionCoordinatorV1.ts",
      "sha256": "5198d2eb120924ef598521806d0a514ded011e027684493470a4d9feae2d643c"
    },
    {
      "path": "src/actions/taskActionRegistryV1.ts",
      "sha256": "5885b2e594bdf842e7cfd6e99c85cc331c195db16d92f2ea57cee0db3c5bbdb6"
    },
    {
      "path": "src/commands/applyCurrentStageAction.ts",
      "sha256": "b4a33bbdf239cee1f5a7603c8dee051c8f93e64696c212fd3d297a99f78d28a1"
    },
    {
      "path": "src/commands/applyHighLevelReviewChanges.ts",
      "sha256": "e12d1f48c5d37c763a8fddaf2b0844c35b69c6170583e8b0d29bc46ab58cdfaf"
    },
    {
      "path": "src/commands/applyLowLevelReviewChanges.ts",
      "sha256": "36227d23efea76ae2a694b42e3585f0f435474fa8b99c2e3571211d48e8657eb"
    },
    {
      "path": "src/commands/archiveTask.ts",
      "sha256": "e15a0e5f605808535ec9e736d1bb517b1a778d5f2dbfcfbb52d2041134e649ad"
    },
    {
      "path": "src/commands/chatWithStage.ts",
      "sha256": "023ea3b9d2e0b641ee2c84362acb97cb080fd8c9060d9997e4178b8c5ff2d657"
    },
    {
      "path": "src/commands/choosePublishScope.ts",
      "sha256": "6a3e82c86bf58a4ced63cd6f4bc7d9f57e5fde2f78ca108febf85cc6bd452ab8"
    },
    {
      "path": "src/commands/commitAndPushTask.ts",
      "sha256": "809dea832a4f37060ed9c67fe43d2abf615a63d62c4805ac8cbbfc9ac4cb62d6"
    },
    {
      "path": "src/commands/configureStepModels.ts",
      "sha256": "ac16c230a6a6811d3b2dcd6a39fb469e94c0049fc9cfb1b1d44444f18ec63d2b"
    },
    {
      "path": "src/commands/draftTaskWithAI.ts",
      "sha256": "7724e12841ca01a9d72a1524c6344358836e7dd02e24c3a467e1b1c4db749312"
    },
    {
      "path": "src/commands/fastForwardCurrentTaskReview.ts",
      "sha256": "19b2a7f08e0d47c8f36c2e81937408c2095cf7330e05ae6fc9e2dfd4bd8b0443"
    },
    {
      "path": "src/commands/generatePlanWithAI.ts",
      "sha256": "7b885ee9d60be8f7be19303cd9ad65d26068d6ec6948e2af572f2f95585d6404"
    },
    {
      "path": "src/commands/markTaskDone.ts",
      "sha256": "fd5f35cddc1b09515edd166349d80791db4ba8666e1f179cf28a4dcfd837fb14"
    },
    {
      "path": "src/commands/openAndStartNewTask.ts",
      "sha256": "d87db897479dbf3bfcf364da06fa283122c79147085e49127bc7a4a8b26d14e9"
    },
    {
      "path": "src/commands/openGeneralAssistant.ts",
      "sha256": "fc2dc920cb454755720a71aad923a5f62750a486ea1274488d167710d5c770bc"
    },
    {
      "path": "src/commands/pauseTask.ts",
      "sha256": "d4a07e2ed9810d921c507329ed38ea657b52410517314a0dc5d4f9f196b6d901"
    },
    {
      "path": "src/commands/pinTask.ts",
      "sha256": "b476c249f77211d16af5c791f4ee61abcf7ff38d26de1ec087a02269e62d030b"
    },
    {
      "path": "src/commands/renameTask.ts",
      "sha256": "d252b25feb2ef8eeaf09a0dfc57d84bca105a9c7980f39b14eddf6f2817a894f"
    },
    {
      "path": "src/commands/resumeTask.ts",
      "sha256": "6428c4fb1ba9ccb14368558ed8421cc000ee88cc090901d6cbbb297b64b73622"
    },
    {
      "path": "src/commands/reviewActions.ts",
      "sha256": "360d638c2139270f9e3842d7343995d2bd56ddc1a34878de5d70a9bbdb5a99f9"
    },
    {
      "path": "src/commands/reviewCurrentTask.ts",
      "sha256": "a605565abcefbf2d64e096965ec768462d6779891ff4ea299f504a2e99b84fc3"
    },
    {
      "path": "src/commands/runLintingFixes.ts",
      "sha256": "8836bfcb3d33783066d3b35d3e328c1189870d7da5fbddc3a36955deab17fe56"
    },
    {
      "path": "src/commands/runPublishChecks.ts",
      "sha256": "c2838974c87aa85ae91bdc546e06f69e23198126543cc3d19567b87035d11509"
    },
    {
      "path": "src/commands/scheduleTaskResume.ts",
      "sha256": "9b18a9b7b3441b54410b6faca5e6d8fbd7bb6fbf6824cf249bf37eea4d963696"
    },
    {
      "path": "src/commands/setTaskStage.ts",
      "sha256": "1660e82e103b14e8419c3df6a752b8edefdb52e3b667c8a12893583a0e64442f"
    },
    {
      "path": "src/commands/startNewTask.ts",
      "sha256": "03fb401a441f7db3bb5504797cf387627be170503952516d1184f5e6b93cce1c"
    },
    {
      "path": "src/commands/toggleMetaResourcesGitIgnore.ts",
      "sha256": "9d87c90cfea8d12496c6d501a46592b25c273c981a51e626e2ad6d1c4a81cf35"
    },
    {
      "path": "src/commands/viewArtifacts.ts",
      "sha256": "f02bdbd50ee66de60c9fbf769557d5ef00c983c45cf352dce1ccb2b4338b3a69"
    },
    {
      "path": "src/commands/viewStageChanges.ts",
      "sha256": "0808f116ba52b228d448f33441df564f1f8d3c499dac3648373823ff767cae03"
    },
    {
      "path": "src/config/settings.ts",
      "sha256": "cf28d72e39c32d1ac93b20f13faee380046c23582cdce3a2b4da662e80b0b4f9"
    },
    {
      "path": "src/extension.ts",
      "sha256": "e1b8b6fde53cfb54e555d42c7527ede338aa23d94d4d19ce6c3719314826192c"
    },
    {
      "path": "src/legal/disclaimerVersion.ts",
      "sha256": "34a90cb78d3c0f598ab0e10d63dc31e09d925de0977613b199b2c616bff80564"
    },
    {
      "path": "src/prompts/aiResultContractV1.ts",
      "sha256": "e942af07428d160e6edbbecf14fc9a51c842650b50e6d3d883285237b0fda012"
    },
    {
      "path": "src/runners/cliAgentRunner.ts",
      "sha256": "837c7abf0ba8b194d6bd36a37c2b6592e9a692827d8c3441fc4a3f58934e001f"
    },
    {
      "path": "src/runners/copilotImplementationRunner.ts",
      "sha256": "3db2b36dffea8caa17ab06d6db61c8068deae33fae36f0356b3c87157cce6212"
    },
    {
      "path": "src/runners/copilotLanguageModelRunner.ts",
      "sha256": "83e6e320044f9771f33034bf8067e226c6b5ff646cf6575c3b535a09e3c2752b"
    },
    {
      "path": "src/runners/copilotModelResolution.ts",
      "sha256": "c34f0f372ba6000cbb3e776523eab7d12fb0411a4583cfffdcf7e6e28ab90c61"
    },
    {
      "path": "src/runners/providers.ts",
      "sha256": "f4ac3c8307d785c556f9d9e146450271a5f514d454aa77de4a2cc4ae14637d15"
    },
    {
      "path": "src/runners/runnerRegistry.ts",
      "sha256": "1a34362c936ecbef04149aa98ddca5a7350e1c42e9328ca096492e7e24290901"
    },
    {
      "path": "src/services/agentExecutionBrokerV1.ts",
      "sha256": "5f886e2a9e738efdb1ae9d305450b97fd7718d519455df9ed47907aa43a8bc79"
    },
    {
      "path": "src/services/chatInteractionTransactionStoreV1.ts",
      "sha256": "d47bdb9b3572ee9926fbaa3a3396ace67d785f48dda6261436554189e261af22"
    },
    {
      "path": "src/services/cliStdoutResultCaptureV1.ts",
      "sha256": "6c2c3618be8149efbb29c49f50b372058571e9b7135a0c6ec1dfd275e1f9664b"
    },
    {
      "path": "src/services/legacyAiActionSafetyGateV0.ts",
      "sha256": "fb42a76ce114c30236ce338afd7348b627b27b49e44fc0b8860f8c5f73a297eb"
    },
    {
      "path": "src/services/providerSelectionPolicyV1.ts",
      "sha256": "fe80c2952ea5d64ec869ad942a91853e34232802c441b5426da86d494f960008"
    },
    {
      "path": "src/services/taskProgressDecoderV1.ts",
      "sha256": "959d049bbe330b99f0098518122f420581c95ab85f7417a303e128b2a93171da"
    },
    {
      "path": "src/services/taskProgressReaderV1.ts",
      "sha256": "470c9adb002cd5aae5028dc8434dfc587fa30f6ef7d7c2e1a50edcd9bd13ddd5"
    },
    {
      "path": "src/services/taskProgressWriterV1.ts",
      "sha256": "3f39a04f737cb1b9d81c977f6d0225615cec9c8155521d2db0c0abaaecdd7531"
    },
    {
      "path": "src/services/vscodeLmCompat.ts",
      "sha256": "9d71af22862bde430ec2713a68088a3f59fcee100d3505cfaeaec6dddb505233"
    },
    {
      "path": "src/services/workflowFileStoreV1.ts",
      "sha256": "83a30245b08b810c49d86f8a5a13f33572ecaeff71e7b334775735eec300de01"
    },
    {
      "path": "src/services/workflowLeaseStoreV1.ts",
      "sha256": "a30d2343a271e109cd13f08a9f56ecd0c427aa981cb3ff3b10e6cb4025f17248"
    },
    {
      "path": "src/services/workflowPathRegistryV1.ts",